{
  "$schema":"https://json-schema.org/draft/2020-12/schema","$id":"https://ubuddy.invalid/schemas/cp-rir-d2-recovery-fsm-manifest-v0.json","type":"object","additionalProperties":false,
  "required":["$schema","schemaVersion","implementationStatus","generatorVersion","grammarId","grammarDigest","horizon","generationMode","paths","pathSetDigest","limitations"],
  "properties":{"$schema":{"const":"ubuddy-cp-rir-d2-recovery-fsm-manifest-v0.schema.json"},"schemaVersion":{"const":"cp-rir/d2-recovery-fsm-manifest/v0"},"implementationStatus":{"const":"prototype/unverified"},"generatorVersion":{"const":"cp-rir/d2-recovery-fsm-generator/v0"},"grammarId":{"type":"string"},"grammarDigest":{"$ref":"#/$defs/digest"},"horizon":{"type":"integer","minimum":1},"generationMode":{"const":"EXPLICIT_PREFIX_ENUMERATION"},"paths":{"type":"array","minItems":1,"items":{"$ref":"#/$defs/path"}},"pathSetDigest":{"$ref":"#/$defs/digest"},"limitations":{"const":["NO_SINK_REPLAY","NO_RECEIPT_CRYPTOGRAPHY","NO_REAL_CRASH_RESTART","NO_FAIRNESS_PROOF"]}},
  "$defs":{"digest":{"type":"string","pattern":"^[a-f0-9]{64}$"},"path":{"type":"object","additionalProperties":false,"required":["pathId","stepCount","states","events","transitionIds","terminal"],"properties":{"pathId":{"type":"string"},"stepCount":{"type":"integer","minimum":0},"states":{"type":"array","minItems":1,"items":{"type":"string"}},"events":{"type":"array","items":{"type":"string"}},"transitionIds":{"type":"array","items":{"type":"string"}},"terminal":{"type":"boolean"}}}}
}
